{
  "schema_version": "wp_runtime_status@1",
  "wp_id": "WP-1-Structured-Collaboration-Schema-Registry-v1",
  "base_wp_id": "WP-1-Structured-Collaboration-Schema-Registry",
  "task_packet": ".GOV/task_packets/WP-1-Structured-Collaboration-Schema-Registry-v1.md",
  "communication_dir": ".GOV/roles_shared/WP_COMMUNICATIONS/WP-1-Structured-Collaboration-Schema-Registry-v1",
  "thread_file": ".GOV/roles_shared/WP_COMMUNICATIONS/WP-1-Structured-Collaboration-Schema-Registry-v1/THREAD.md",
  "runtime_status_file": ".GOV/roles_shared/WP_COMMUNICATIONS/WP-1-Structured-Collaboration-Schema-Registry-v1/RUNTIME_STATUS.json",
  "receipts_file": ".GOV/roles_shared/WP_COMMUNICATIONS/WP-1-Structured-Collaboration-Schema-Registry-v1/RECEIPTS.jsonl",
  "workflow_lane": "ORCHESTRATOR_MANAGED",
  "execution_owner": "CODER_A",
  "workflow_authority": "ORCHESTRATOR",
  "technical_advisor": "WP_VALIDATOR",
  "technical_authority": "INTEGRATION_VALIDATOR",
  "merge_authority": "INTEGRATION_VALIDATOR",
  "wp_validator_of_record": "019ceb10-00fb-7793-97a0-7cd9179a5688",
  "integration_validator_of_record": "019cee0b-95a7-7872-b1bf-717ddfd72c39",
  "secondary_validator_sessions": [],
  "agentic_mode": "NO",
  "current_packet_status": "Done",
  "runtime_status": "input_required",
  "current_phase": "VALIDATION_PRESENTED",
  "next_expected_actor": "OPERATOR",
  "waiting_on": "GATE_4_USER_ACKNOWLEDGMENT_BEFORE_MAIN_MERGE",
  "validator_trigger": "NONE",
  "validator_trigger_reason": null,
  "attention_required": true,
  "ready_for_validation": false,
  "ready_for_validation_reason": null,
  "current_branch": "feat/WP-1-Structured-Collaboration-Schema-Registry-v1",
  "current_worktree_dir": "../wt-WP-1-Structured-Collaboration-Schema-Registry-v1",
  "current_files_touched": [],
  "active_role_sessions": [
    {
      "role": "ORCHESTRATOR",
      "session_id": "orchestrator-smoketest-20260314",
      "authority_kind": "WORKFLOW_AUTHORITY",
      "validator_role_kind": null,
      "worktree_dir": "../wt-WP-1-Structured-Collaboration-Schema-Registry-v1",
      "state": "working",
      "last_heartbeat_at": "2026-03-14T23:48:52.796Z"
    },
    {
      "role": "VALIDATOR",
      "session_id": "019cee0b-95a7-7872-b1bf-717ddfd72c39",
      "authority_kind": "INTEGRATION_VALIDATOR",
      "validator_role_kind": "INTEGRATION_VALIDATOR",
      "worktree_dir": "../wt-INTV-WP-1-Structured-Collaboration-Schema-Registry-v1",
      "state": "completed",
      "last_heartbeat_at": "2026-03-14T23:48:52.796Z"
    }
  ],
  "last_event": "validation_report_presented_waiting_user_ack",
  "last_event_at": "2026-03-15T00:05:35.9137705Z",
  "last_heartbeat_at": "2026-03-15T00:05:35.9137705Z",
  "heartbeat_interval_minutes": 15,
  "heartbeat_due_at": "2026-03-15T00:20:35.9137705Z",
  "stale_after": "2026-03-15T00:50:35.9137705Z",
  "max_coder_revision_cycles": 3,
  "max_validator_review_cycles": 3,
  "max_relay_escalation_cycles": 2,
  "current_coder_revision_cycle": 0,
  "current_validator_review_cycle": 0,
  "current_relay_escalation_cycle": 0,
  "last_backup_push_at": null,
  "last_backup_push_sha": null
}
